{
  "id": "2026-04-25-ai",
  "date": "2026-04-25",
  "category": "ai",
  "title": {
    "en": "The Shift in Agentic Frameworks",
    "zh": "智能体框架的转向"
  },
  "summary": {
    "en": "Developer tooling is consolidating around lightweight autonomous loops. Instead of monolithic orchestration, more runtimes now favor composable units that are easier to test and control.",
    "zh": "开发者工具正在向轻量化自治循环收敛。相比单体编排，越来越多运行时开始偏好可组合、可测试、可控的小单元。"
  },
  "observations": [
    {
      "en": "Heavy frameworks are losing ground to functional state-machine style runtimes.",
      "zh": "重型框架正在让位于函数式状态机风格的运行时。"
    },
    {
      "en": "Deterministic evaluation suites are increasingly paired with generative workflows.",
      "zh": "确定性评测套件正在更紧密地与生成式流程并行。"
    },
    {
      "en": "Latency constraints are pushing more inference and orchestration to edge environments.",
      "zh": "延迟约束正在推动更多推理与编排能力下沉到边缘环境。"
    }
  ],
  "quote": {
    "en": "The best agent knows when to stop and ask for clarification.",
    "zh": "最好的智能体知道何时停止行动并请求澄清。"
  },
  "links": [
    {
      "title": {
        "en": "Read: The Architecture of Trust",
        "zh": "阅读：信任架构"
      },
      "url": "https://research.anthropic.com",
      "domain": "research.anthropic.com"
    },
    {
      "title": {
        "en": "Tooling: LiteChain v2.0 Release",
        "zh": "工具：LiteChain v2.0 发布"
      },
      "url": "https://github.com/litechain",
      "domain": "github.com/litechain"
    }
  ]
}
