{
  "id": "2026-04-25-miscellaneous",
  "date": "2026-04-25",
  "category": "miscellaneous",
  "title": {
    "en": "Synthetics and the Data Wall",
    "zh": "合成数据与数据墙"
  },
  "summary": {
    "en": "As high-quality human text gets exhausted, synthetic data pipelines with iterative correction are becoming standard. The key challenge is retaining diversity while avoiding recursive degradation.",
    "zh": "随着高质量人类文本逐渐耗尽，带有迭代纠错的合成数据流水线正成为常态。关键挑战是既保持多样性，又避免递归训练带来的退化。"
  },
  "observations": [
    {
      "en": "Self-rewarding loops are improving reasoning scores in controlled settings.",
      "zh": "自奖励循环在受控场景中持续提升推理表现。"
    },
    {
      "en": "Recursive synthetic training still carries model-collapse risk without strict curation.",
      "zh": "若缺少严格筛选，递归式合成训练仍有模型坍塌风险。"
    },
    {
      "en": "Human-in-the-loop review remains the strongest quality differentiator.",
      "zh": "人类参与审校仍是数据质量最强的区分因素。"
    }
  ],
  "quote": {
    "en": "When we run out of historical data, we must design how to learn from what we generate.",
    "zh": "当历史数据趋于枯竭，我们必须设计如何从自生成内容中继续学习。"
  },
  "links": [
    {
      "title": {
        "en": "Paper: Self-Correction in LLMs",
        "zh": "论文：LLM 中的自我纠错"
      },
      "url": "https://arxiv.org",
      "domain": "arxiv.org"
    },
    {
      "title": {
        "en": "Opinion: The End of Scaling",
        "zh": "观点：规模扩展的拐点"
      },
      "url": "https://substack.com",
      "domain": "substack.com"
    }
  ]
}
